{
  "id": "b1dfe377-83f8-4f86-80f9-39e39804ce67",
  "client_name": "Testco UK",
  "tender_label": "Electricity tender — July 2026",
  "utility": "electricity",
  "status": "draft",
  "version": 1,
  "created_at": "2026-07-15T14:49:00Z",
  "created_by": "rory@rye.energy",
  "expires_at": "2026-07-31",
  "day_split": 0.7,
  "url_uuid": "92744fcc-f0f0-4787-b461-ce5f20af3149",
  "slug": "testco-uk",
  "dashboard_url": null,
  "recommended": {
    "supplier": "Testco",
    "term": "12 months"
  },
  "rye_fee": {
    "list_price_site_month": 90,
    "discount_pct": 80,
    "label": "RYE fee (year 1, 80% discount)"
  },
  "sites": [
    {
      "mpxn": "1200035438587",
      "site_name": "Head Office",
      "eac": 50000.0,
      "kva": null,
      "eac_source": "quote"
    },
    {
      "mpxn": "1200035000000",
      "site_name": "Warehouse 1",
      "eac": 120000.0,
      "kva": 100.0,
      "eac_source": "quote"
    }
  ],
  "incumbent": {
    "supplier": "British Gas",
    "term": "current",
    "lines": [
      {
        "mpxn": "1200035438587",
        "unitRate": 27.0,
        "standingCharge": 50.0
      },
      {
        "mpxn": "1200035000000",
        "dayRate": 29.0,
        "nightRate": 20.0,
        "standingCharge": 65.0
      }
    ]
  },
  "quotes": [
    {
      "supplier": "Testco",
      "term": "12 months",
      "category": "fixed",
      "lines": [
        {
          "mpxn": "1200035438587",
          "supplyStartDate": "2026-08-01",
          "unitRate": 24.5,
          "dayRate": null,
          "nightRate": null,
          "standingCharge": 45.2,
          "capacityCharge": null,
          "networkCharge": 1.1,
          "meterCharge": 0.5
        },
        {
          "mpxn": "1200035000000",
          "supplyStartDate": "2026-08-01",
          "unitRate": null,
          "dayRate": 26.1,
          "nightRate": 18.3,
          "standingCharge": 60.0,
          "capacityCharge": null,
          "networkCharge": 2.0,
          "meterCharge": 0.5
        }
      ]
    },
    {
      "supplier": "Testco",
      "term": "24 months",
      "category": "fixed",
      "lines": [
        {
          "mpxn": "1200035438587",
          "supplyStartDate": "2026-08-01",
          "unitRate": 23.9,
          "dayRate": null,
          "nightRate": null,
          "standingCharge": 45.2,
          "capacityCharge": null,
          "networkCharge": 1.1,
          "meterCharge": 0.5
        },
        {
          "mpxn": "1200035000000",
          "supplyStartDate": "2026-08-01",
          "unitRate": null,
          "dayRate": 25.4,
          "nightRate": 17.8,
          "standingCharge": 60.0,
          "capacityCharge": null,
          "networkCharge": 2.0,
          "meterCharge": 0.5
        }
      ]
    }
  ],
  "notes": [
    "Synthetic fixture for Phase-0 verification."
  ]
}